{"awaiting_decision_for":"recover-access","completed_at":null,"continuation_decisions":[{"after_item_id":"authenticate","decided_at":"2026-09-21T21:32:05.226Z","decided_by":"Mário Tinelli","decision":"continue","progress_sha256":"b91b6d47b94677d69743d6b9d2ffb7d8d15f8cca7788070b6a04b45b61058b52"}],"current_item_id":null,"items":[{"catalog_item_id":"authenticate","dependency_evidence_sha256":null,"dependency_status":"not-required","feature_dir":"features/1014446-autenticacao","feature_state_path":"features/1014446-autenticacao/.flow/feature-state.json","issue_id":1014446,"position":1,"publication_evidence_sha256":"061a9daf6e5d6b84933595a677325dd4ca64e9047602a83668e40436cd50b1e0","requirement_sha256":"27bd56bbf9f72baeca20c4cad1e3319edecc2d6177c5e0992b391dc9c4bf79ca","status":"completed","title":"[WEB] [PUBLICO] Autenticação"},{"catalog_item_id":"recover-access","dependency_evidence_sha256":null,"dependency_status":"not-required","feature_dir":"features/1014447-recuperacao-de-senha","feature_state_path":"features/1014447-recuperacao-de-senha/.flow/feature-state.json","issue_id":1014447,"position":2,"publication_evidence_sha256":"0f2d4011254f7c48ca2bb528e48e9dba7fa0118c1c51914678221baa43bd8d23","requirement_sha256":"93d1a002be3b3fc0bf30b875525a20ff8f48dd59c37ac0db1da9ef101dd474cc","status":"completed","title":"[WEB] [PUBLICO] Recuperação de Senha"},{"catalog_item_id":"maintain-own-profile","dependency_evidence_sha256":null,"dependency_status":"unknown","feature_dir":"features/1014448-meu-perfil","feature_state_path":"features/1014448-meu-perfil/.flow/feature-state.json","issue_id":1014448,"position":3,"publication_evidence_sha256":null,"requirement_sha256":"ea1ca6adc333be9a9c67d05d16e78355be676d67f2686d8ee42f79e27bb053cd","status":"pending","title":"[WEB] [OPERACIONAL] Meu Perfil"},{"catalog_item_id":"administer-users","dependency_evidence_sha256":null,"dependency_status":"unknown","feature_dir":"features/1014449-gestao-de-usuario","feature_state_path":"features/1014449-gestao-de-usuario/.flow/feature-state.json","issue_id":1014449,"position":4,"publication_evidence_sha256":null,"requirement_sha256":"b62647b8d9d1f5ee5ca9021f1d0bf65b40da39a68c6b7572994d17ef89bb5701","status":"pending","title":"[WEB] [ADMIN] Gestão de Usuário"},{"catalog_item_id":"manage-project","dependency_evidence_sha256":null,"dependency_status":"unknown","feature_dir":"features/1014450-gestao-de-projeto","feature_state_path":"features/1014450-gestao-de-projeto/.flow/feature-state.json","issue_id":1014450,"position":5,"publication_evidence_sha256":null,"requirement_sha256":"3b4ef5cf44920c4c96579ce233518a986095c702671d1196da82223aa58abc9d","status":"pending","title":"[WEB] [OPERACIONAL] Gestão de Projeto"},{"catalog_item_id":"manage-task","dependency_evidence_sha256":null,"dependency_status":"unknown","feature_dir":"features/1014454-gestao-de-tarefa","feature_state_path":"features/1014454-gestao-de-tarefa/.flow/feature-state.json","issue_id":1014454,"position":6,"publication_evidence_sha256":null,"requirement_sha256":"5e758dcfb4faa537d6870fb600d9d57a693fe2741550e5bfd0006755424564a7","status":"pending","title":"[WEB] [OPERACIONAL] Gestão de Tarefa"},{"catalog_item_id":"search-tasks","dependency_evidence_sha256":null,"dependency_status":"unknown","feature_dir":"features/1014465-consulta-de-tarefas","feature_state_path":"features/1014465-consulta-de-tarefas/.flow/feature-state.json","issue_id":1014465,"position":7,"publication_evidence_sha256":null,"requirement_sha256":"da590f2972c1ed48e865ff410b5685017336eeed26ced9b8cc682f28ef1f7164","status":"pending","title":"[WEB] [OPERACIONAL] Consulta de Tarefas"},{"catalog_item_id":"manage-time","dependency_evidence_sha256":null,"dependency_status":"unknown","feature_dir":"features/1014493-gestao-de-tempo","feature_state_path":"features/1014493-gestao-de-tempo/.flow/feature-state.json","issue_id":1014493,"position":8,"publication_evidence_sha256":null,"requirement_sha256":"0439e88ac1f28d28d0f781d21a4bd51a8e725a682e9b7cb3e810584dc74c8440","status":"pending","title":"[WEB] [OPERACIONAL] Gestão de Tempo"},{"catalog_item_id":"my-tasks","dependency_evidence_sha256":null,"dependency_status":"unknown","feature_dir":"features/1014547-minhas-tarefas","feature_state_path":"features/1014547-minhas-tarefas/.flow/feature-state.json","issue_id":1014547,"position":9,"publication_evidence_sha256":null,"requirement_sha256":"6c7a93bbce7ff7013f98ad93977616a8f24336b792e1c4e808fae92be56f65c6","status":"pending","title":"[WEB] [OPERACIONAL] Minhas Tarefas"},{"catalog_item_id":"manage-project-board","dependency_evidence_sha256":null,"dependency_status":"unknown","feature_dir":"features/1014548-quadro-do-projeto","feature_state_path":"features/1014548-quadro-do-projeto/.flow/feature-state.json","issue_id":1014548,"position":10,"publication_evidence_sha256":null,"requirement_sha256":"07070b18faa7c6f9e57d543ef052f13a2b192e2458220451831a7521ad89f884","status":"pending","title":"[WEB] [OPERACIONAL] Quadro do Projeto"},{"catalog_item_id":"view-management-dashboard","dependency_evidence_sha256":null,"dependency_status":"unknown","feature_dir":"features/1014550-painel-gerencial","feature_state_path":"features/1014550-painel-gerencial/.flow/feature-state.json","issue_id":1014550,"position":11,"publication_evidence_sha256":null,"requirement_sha256":"84121a2e81b8516a76b783b1679efbf2dc78ea2b9d65289be0f5031bee9f0019","status":"pending","title":"[WEB] [OPERACIONAL] Painel Gerencial"}],"observations":[{"items":[{"catalog_item_id":"authenticate","dependency_evidence_sha256":null,"dependency_status":"unknown","feature_dir":"features/1014446-autenticacao","feature_state_path":"features/1014446-autenticacao/.flow/feature-state.json","issue_id":1014446,"position":1,"publication_evidence_sha256":null,"requirement_sha256":"27bd56bbf9f72baeca20c4cad1e3319edecc2d6177c5e0992b391dc9c4bf79ca","status":"pending","title":"[WEB] [PUBLICO] Autenticação"},{"catalog_item_id":"recover-access","dependency_evidence_sha256":null,"dependency_status":"unknown","feature_dir":"features/1014447-recuperacao-de-senha","feature_state_path":"features/1014447-recuperacao-de-senha/.flow/feature-state.json","issue_id":1014447,"position":2,"publication_evidence_sha256":null,"requirement_sha256":"93d1a002be3b3fc0bf30b875525a20ff8f48dd59c37ac0db1da9ef101dd474cc","status":"pending","title":"[WEB] [PUBLICO] Recuperação de Senha"},{"catalog_item_id":"maintain-own-profile","dependency_evidence_sha256":null,"dependency_status":"unknown","feature_dir":"features/1014448-meu-perfil","feature_state_path":"features/1014448-meu-perfil/.flow/feature-state.json","issue_id":1014448,"position":3,"publication_evidence_sha256":null,"requirement_sha256":"ea1ca6adc333be9a9c67d05d16e78355be676d67f2686d8ee42f79e27bb053cd","status":"pending","title":"[WEB] [OPERACIONAL] Meu Perfil"},{"catalog_item_id":"administer-users","dependency_evidence_sha256":null,"dependency_status":"unknown","feature_dir":"features/1014449-gestao-de-usuario","feature_state_path":"features/1014449-gestao-de-usuario/.flow/feature-state.json","issue_id":1014449,"position":4,"publication_evidence_sha256":null,"requirement_sha256":"b62647b8d9d1f5ee5ca9021f1d0bf65b40da39a68c6b7572994d17ef89bb5701","status":"pending","title":"[WEB] [ADMIN] Gestão de Usuário"},{"catalog_item_id":"manage-project","dependency_evidence_sha256":null,"dependency_status":"unknown","feature_dir":"features/1014450-gestao-de-projeto","feature_state_path":"features/1014450-gestao-de-projeto/.flow/feature-state.json","issue_id":1014450,"position":5,"publication_evidence_sha256":null,"requirement_sha256":"3b4ef5cf44920c4c96579ce233518a986095c702671d1196da82223aa58abc9d","status":"pending","title":"[WEB] [OPERACIONAL] Gestão de Projeto"},{"catalog_item_id":"manage-task","dependency_evidence_sha256":null,"dependency_status":"unknown","feature_dir":"features/1014454-gestao-de-tarefa","feature_state_path":"features/1014454-gestao-de-tarefa/.flow/feature-state.json","issue_id":1014454,"position":6,"publication_evidence_sha256":null,"requirement_sha256":"5e758dcfb4faa537d6870fb600d9d57a693fe2741550e5bfd0006755424564a7","status":"pending","title":"[WEB] [OPERACIONAL] Gestão de Tarefa"},{"catalog_item_id":"search-tasks","dependency_evidence_sha256":null,"dependency_status":"unknown","feature_dir":"features/1014465-consulta-de-tarefas","feature_state_path":"features/1014465-consulta-de-tarefas/.flow/feature-state.json","issue_id":1014465,"position":7,"publication_evidence_sha256":null,"requirement_sha256":"da590f2972c1ed48e865ff410b5685017336eeed26ced9b8cc682f28ef1f7164","status":"pending","title":"[WEB] [OPERACIONAL] Consulta de Tarefas"},{"catalog_item_id":"manage-time","dependency_evidence_sha256":null,"dependency_status":"unknown","feature_dir":"features/1014493-gestao-de-tempo","feature_state_path":"features/1014493-gestao-de-tempo/.flow/feature-state.json","issue_id":1014493,"position":8,"publication_evidence_sha256":null,"requirement_sha256":"0439e88ac1f28d28d0f781d21a4bd51a8e725a682e9b7cb3e810584dc74c8440","status":"pending","title":"[WEB] [OPERACIONAL] Gestão de Tempo"},{"catalog_item_id":"my-tasks","dependency_evidence_sha256":null,"dependency_status":"unknown","feature_dir":"features/1014547-minhas-tarefas","feature_state_path":"features/1014547-minhas-tarefas/.flow/feature-state.json","issue_id":1014547,"position":9,"publication_evidence_sha256":null,"requirement_sha256":"6c7a93bbce7ff7013f98ad93977616a8f24336b792e1c4e808fae92be56f65c6","status":"pending","title":"[WEB] [OPERACIONAL] Minhas Tarefas"},{"catalog_item_id":"manage-project-board","dependency_evidence_sha256":null,"dependency_status":"unknown","feature_dir":"features/1014548-quadro-do-projeto","feature_state_path":"features/1014548-quadro-do-projeto/.flow/feature-state.json","issue_id":1014548,"position":10,"publication_evidence_sha256":null,"requirement_sha256":"07070b18faa7c6f9e57d543ef052f13a2b192e2458220451831a7521ad89f884","status":"pending","title":"[WEB] [OPERACIONAL] Quadro do Projeto"},{"catal